{
  "schema_version": "goal-teams-rule-manifest-v2.49",
  "generation_id": "V2.49",
  "manifest_state": "derived_projection",
  "semantic_source": "owner_markdown_only",
  "source_digest_algorithm": "sha256_raw_file_bytes",
  "owners": [
    {
      "owner_id": "CORE-V249",
      "owner_kind": "core",
      "path": "references/current/generations/V2.49/core.md",
      "source_sha256": "779714ad2b5e74ab2ce4f2df63e9f038aa374229d5eb1a57a256f08ca21b2d9e",
      "dependencies": ["ROUTING-V249", "ASSURANCE-V249", "CONTRACT-TASK-STATE-V249", "CONTRACT-HARNESS-EVIDENCE-V249", "CONTRACT-REVIEW-COMPLETION-V249", "CONTRACT-APPROVAL-SIDE-EFFECTS-V249"],
      "route_membership": ["V249-ROUTE-STARTUP", "V249-ROUTE-DISCUSSION", "V249-ROUTE-SMALL-DEVELOPMENT", "V249-ROUTE-MEDIUM-DEVELOPMENT", "V249-ROUTE-LARGE-DEVELOPMENT", "V249-ROUTE-UI-DESKTOP", "V249-ROUTE-AGENT-RUNTIME", "V249-ROUTE-MEDIUM-RELEASE", "V249-ROUTE-LARGE-RELEASE"],
      "owned_rule_ids": ["GT249-CORE-SCOPE", "GT249-CORE-AUTHORITY", "GT249-CORE-TRUTH", "GT249-CORE-SSOT", "GT249-CORE-EVIDENCE", "GT249-CORE-INDEPENDENCE", "GT249-CORE-SAFETY", "GT249-CORE-LOOP"]
    },
    {
      "owner_id": "ROUTING-V249",
      "owner_kind": "routing",
      "path": "references/current/generations/V2.49/routing.md",
      "source_sha256": "5c49b834a02d2f9fbccc5e141605d919483dd0622fd7156b10268fa10a4cd058",
      "dependencies": ["CORE-V249", "ASSURANCE-V249", "CONTRACT-TASK-STATE-V249", "CONTRACT-APPROVAL-SIDE-EFFECTS-V249"],
      "route_membership": ["V249-ROUTE-STARTUP", "V249-ROUTE-DISCUSSION", "V249-ROUTE-SMALL-DEVELOPMENT", "V249-ROUTE-MEDIUM-DEVELOPMENT", "V249-ROUTE-LARGE-DEVELOPMENT", "V249-ROUTE-UI-DESKTOP", "V249-ROUTE-AGENT-RUNTIME", "V249-ROUTE-MEDIUM-RELEASE", "V249-ROUTE-LARGE-RELEASE"],
      "owned_rule_ids": ["GT249-ROUTE-TRUSTED-FACTS", "GT249-ROUTE-SIZE", "GT249-ROUTE-ASSURANCE", "GT249-ROUTE-PHASE", "GT249-ROUTE-REPLAY", "GT249-ROUTE-EXPLAIN"]
    },
    {
      "owner_id": "ASSURANCE-V249",
      "owner_kind": "assurance",
      "path": "references/current/generations/V2.49/assurance-levels.md",
      "source_sha256": "708ed88ed33d0b7e4f7403ecb4d97d71f4a0056bb029483a132929a43e61dc73",
      "dependencies": ["CORE-V249", "ROUTING-V249", "CONTRACT-HARNESS-EVIDENCE-V249", "CONTRACT-REVIEW-COMPLETION-V249"],
      "route_membership": ["V249-ROUTE-STARTUP", "V249-ROUTE-DISCUSSION", "V249-ROUTE-SMALL-DEVELOPMENT", "V249-ROUTE-MEDIUM-DEVELOPMENT", "V249-ROUTE-LARGE-DEVELOPMENT", "V249-ROUTE-UI-DESKTOP", "V249-ROUTE-AGENT-RUNTIME", "V249-ROUTE-MEDIUM-RELEASE", "V249-ROUTE-LARGE-RELEASE"],
      "owned_rule_ids": ["GT249-ASSURE-DISCUSSION", "GT249-ASSURE-LITE", "GT249-ASSURE-STANDARD", "GT249-ASSURE-FULL", "GT249-ASSURE-REGULATED", "GT249-ASSURE-NONESCALATION"]
    },
    {
      "owner_id": "FUNCTION-REQUIREMENTS-V249",
      "owner_kind": "function",
      "path": "references/current/generations/V2.49/functions/requirements.md",
      "source_sha256": "822c8db7b0d1a658777f1a90b91042db243abdc90dcbade543299117de2cad99",
      "dependencies": ["CORE-V249", "ROUTING-V249", "CONTRACT-TASK-STATE-V249", "CONTRACT-TEST-CASE-GATE-V249"],
      "route_membership": ["V249-ROUTE-DISCUSSION", "V249-ROUTE-SMALL-DEVELOPMENT", "V249-ROUTE-MEDIUM-DEVELOPMENT", "V249-ROUTE-LARGE-DEVELOPMENT", "V249-ROUTE-UI-DESKTOP", "V249-ROUTE-AGENT-RUNTIME", "V249-ROUTE-MEDIUM-RELEASE", "V249-ROUTE-LARGE-RELEASE"],
      "owned_rule_ids": ["GT249-REQ-TRACEABILITY", "GT249-REQ-AC", "GT249-REQ-SCOPE", "GT249-REQ-CHANGE", "GT249-REQ-DENOMINATOR-SEED"]
    },
    {
      "owner_id": "FUNCTION-ARCHITECTURE-IMPLEMENTATION-V249",
      "owner_kind": "function",
      "path": "references/current/generations/V2.49/functions/architecture-implementation.md",
      "source_sha256": "bd25444ca1eae06136eb4f0e8e0dee3d7b8113e0de47631f44a564505ff95d02",
      "dependencies": ["FUNCTION-REQUIREMENTS-V249", "FUNCTION-TESTING-V249", "CONTRACT-TEST-CASE-GATE-V249", "CONTRACT-HARNESS-EVIDENCE-V249", "CONTRACT-TASK-STATE-V249"],
      "route_membership": ["V249-ROUTE-SMALL-DEVELOPMENT", "V249-ROUTE-MEDIUM-DEVELOPMENT", "V249-ROUTE-LARGE-DEVELOPMENT", "V249-ROUTE-UI-DESKTOP", "V249-ROUTE-AGENT-RUNTIME", "V249-ROUTE-MEDIUM-RELEASE", "V249-ROUTE-LARGE-RELEASE"],
      "owned_rule_ids": ["GT249-ARCH-TRIGGER", "GT249-ARCH-ENVIRONMENT", "GT249-IMPL-TDD", "GT249-IMPL-INCREMENTAL", "GT249-IMPL-IDENTITY"]
    },
    {
      "owner_id": "FUNCTION-TESTING-V249",
      "owner_kind": "function",
      "path": "references/current/generations/V2.49/functions/testing.md",
      "source_sha256": "711794ae0fde831913dc8ef74ff35789997e800f3838ea14db6f6af398acf340",
      "dependencies": ["FUNCTION-REQUIREMENTS-V249", "CORE-V249", "CONTRACT-TEST-CASE-GATE-V249", "CONTRACT-HARNESS-EVIDENCE-V249", "CONTRACT-REVIEW-COMPLETION-V249"],
      "route_membership": ["V249-ROUTE-SMALL-DEVELOPMENT", "V249-ROUTE-MEDIUM-DEVELOPMENT", "V249-ROUTE-LARGE-DEVELOPMENT", "V249-ROUTE-UI-DESKTOP", "V249-ROUTE-AGENT-RUNTIME", "V249-ROUTE-MEDIUM-RELEASE", "V249-ROUTE-LARGE-RELEASE"],
      "owned_rule_ids": ["GT249-TEST-DENOMINATOR", "GT249-TEST-PHASES", "GT249-TEST-DEVELOPMENT", "GT249-TEST-RELEASE", "GT249-TEST-ORACLE", "GT249-TEST-DEFECT", "GT249-TEST-COVERAGE"]
    },
    {
      "owner_id": "FUNCTION-UI-DESKTOP-V249",
      "owner_kind": "function",
      "path": "references/current/generations/V2.49/functions/ui-desktop.md",
      "source_sha256": "5fd4559e9fc9c707360a22357b34debf42204610ffd348c0065c66dabfc51da3",
      "dependencies": ["FUNCTION-REQUIREMENTS-V249", "FUNCTION-TESTING-V249", "FUNCTION-AGENT-RUNTIME-V249", "CONTRACT-TEST-CASE-GATE-V249", "CONTRACT-HARNESS-EVIDENCE-V249"],
      "route_membership": ["V249-ROUTE-UI-DESKTOP"],
      "owned_rule_ids": ["GT249-UI-TRIGGER", "GT249-UI-STATE-MATRIX", "GT249-UI-E2E", "GT249-UI-PIXEL", "GT249-DESKTOP-CAPABILITY"]
    },
    {
      "owner_id": "FUNCTION-AGENT-RUNTIME-V249",
      "owner_kind": "function",
      "path": "references/current/generations/V2.49/functions/agent-runtime.md",
      "source_sha256": "4737d1a523ee33792fcfa7814c43060e6aa570f7760420b3af42808bcc213026",
      "dependencies": ["CORE-V249", "ROUTING-V249", "CONTRACT-TASK-STATE-V249", "CONTRACT-HARNESS-EVIDENCE-V249", "CONTRACT-REVIEW-COMPLETION-V249"],
      "route_membership": ["V249-ROUTE-LARGE-DEVELOPMENT", "V249-ROUTE-UI-DESKTOP", "V249-ROUTE-AGENT-RUNTIME", "V249-ROUTE-MEDIUM-RELEASE", "V249-ROUTE-LARGE-RELEASE"],
      "owned_rule_ids": ["GT249-RUNTIME-CAPABILITY", "GT249-RUNTIME-PROMPT", "GT249-RUNTIME-DISPATCH", "GT249-RUNTIME-ASSURANCE", "GT249-RUNTIME-TRANSITION"]
    },
    {
      "owner_id": "FUNCTION-RELEASE-OPERATIONS-V249",
      "owner_kind": "function",
      "path": "references/current/generations/V2.49/functions/release-operations.md",
      "source_sha256": "f9c11579e69dfb41f1c45fdab3900c01154842eda28bbf44d599848113ff29b9",
      "dependencies": ["FUNCTION-TESTING-V249", "FUNCTION-AGENT-RUNTIME-V249", "CONTRACT-TEST-CASE-GATE-V249", "CONTRACT-HARNESS-EVIDENCE-V249", "CONTRACT-REVIEW-COMPLETION-V249", "CONTRACT-APPROVAL-SIDE-EFFECTS-V249"],
      "route_membership": ["V249-ROUTE-MEDIUM-RELEASE", "V249-ROUTE-LARGE-RELEASE"],
      "owned_rule_ids": ["GT249-RELEASE-ENTRY", "GT249-RELEASE-S1", "GT249-RELEASE-S2", "GT249-RELEASE-BOUNDARY", "GT249-RELEASE-S3", "GT249-RELEASE-S4", "GT249-RELEASE-SSH", "GT249-RELEASE-REPAIR"]
    },
    {
      "owner_id": "CONTRACT-TASK-STATE-V249",
      "owner_kind": "contract",
      "path": "references/current/generations/V2.49/contracts/task-state.md",
      "source_sha256": "f55fa312e051e27f8e3912e56448c44ab3adfb15e2f12ca39c1ee00b0611f243",
      "dependencies": ["CORE-V249", "CONTRACT-HARNESS-EVIDENCE-V249", "CONTRACT-REVIEW-COMPLETION-V249"],
      "route_membership": ["V249-ROUTE-STARTUP", "V249-ROUTE-DISCUSSION", "V249-ROUTE-SMALL-DEVELOPMENT", "V249-ROUTE-MEDIUM-DEVELOPMENT", "V249-ROUTE-LARGE-DEVELOPMENT", "V249-ROUTE-UI-DESKTOP", "V249-ROUTE-AGENT-RUNTIME", "V249-ROUTE-MEDIUM-RELEASE", "V249-ROUTE-LARGE-RELEASE"],
      "owned_rule_ids": ["GT249-STATE-ORTHOGONAL", "GT249-STATE-VOCABULARY", "GT249-STATE-EVENTS", "GT249-STATE-TRANSITION", "GT249-STATE-OUTPUT", "GT249-STATE-REPLAY-SEPARATION"]
    },
    {
      "owner_id": "CONTRACT-TEST-CASE-GATE-V249",
      "owner_kind": "contract",
      "path": "references/current/generations/V2.49/contracts/test-case-gate.md",
      "source_sha256": "5b0e32d14c60a4b8816ac986d1777370a8509ba4e7df133f6264eaf4512a466a",
      "dependencies": ["CORE-V249", "CONTRACT-HARNESS-EVIDENCE-V249", "CONTRACT-REVIEW-COMPLETION-V249"],
      "route_membership": ["V249-ROUTE-SMALL-DEVELOPMENT", "V249-ROUTE-MEDIUM-DEVELOPMENT", "V249-ROUTE-LARGE-DEVELOPMENT", "V249-ROUTE-UI-DESKTOP", "V249-ROUTE-AGENT-RUNTIME", "V249-ROUTE-MEDIUM-RELEASE", "V249-ROUTE-LARGE-RELEASE"],
      "owned_rule_ids": ["GT249-TESTCASE-CHAIN", "GT249-TESTCASE-IMMUTABLE", "GT249-TESTCASE-TDD", "GT249-TESTCASE-GATE-STATE", "GT249-TESTCASE-NOT-REQUIRED", "GT249-TESTCASE-REVIEW"]
    },
    {
      "owner_id": "CONTRACT-HARNESS-EVIDENCE-V249",
      "owner_kind": "contract",
      "path": "references/current/generations/V2.49/contracts/harness-evidence.md",
      "source_sha256": "1b6c37633ca50f4f13ac3245aa39312ae03fe4ec3a1f60e32963333cdbf4d2d3",
      "dependencies": ["CORE-V249", "CONTRACT-TASK-STATE-V249", "CONTRACT-TEST-CASE-GATE-V249"],
      "route_membership": ["V249-ROUTE-SMALL-DEVELOPMENT", "V249-ROUTE-MEDIUM-DEVELOPMENT", "V249-ROUTE-LARGE-DEVELOPMENT", "V249-ROUTE-UI-DESKTOP", "V249-ROUTE-AGENT-RUNTIME", "V249-ROUTE-MEDIUM-RELEASE", "V249-ROUTE-LARGE-RELEASE"],
      "owned_rule_ids": ["GT249-HARNESS-ASSERTION", "GT249-HARNESS-EXECUTION", "GT249-EVIDENCE-BINDING", "GT249-EVIDENCE-VALIDITY", "GT249-EVIDENCE-SIDE-EFFECT", "GT249-EVIDENCE-APPEND-ONLY"]
    },
    {
      "owner_id": "CONTRACT-REVIEW-COMPLETION-V249",
      "owner_kind": "contract",
      "path": "references/current/generations/V2.49/contracts/review-completion.md",